<?xml version="1.0" encoding="UTF-8"?>
<!DOCTYPE menu SYSTEM "menu.dtd">
<menu>
    <meals>
        <meal>
            <name>Beetroot and Feta Salad</name>
            <price>15.00</price>
            <description>Suitable for vegetarians, made with fresh beetroot.</description>
            <image>images/beetroot_salad.jpg</image>
        </meal>
        <meal>
            <name>Sourdough Rye Sandwich</name>
            <price>18.00</price>
            <description>Cheese and salad sandwich made with organic, sourdough rye bread.</description>
            <image>images/sourdough_sandwich.jpg</image>
        </meal>
        <meal>
            <name>Spinach Pie and Salad</name>
            <price>20.00</price>
            <description>Tasty pie with salad.</description>
            <image>images/spinach_pie.jpg</image>
        </meal>
        <meal>
            <name>Feta Pancakes with Salad</name>
            <price>19.50</price>
            <description>Tasty pancake filled with feta and salad.</description>
            <image>images/feta_pancakes.jpg</image>
        </meal>
    </meals>
    <beverages>
        <hot>
            <size>Small</size>
            <price>3.50</price>
            <description>For coffee, please inform the staff of the coffee type.</description>
        </hot>
        <hot>
            <size>Regular</size>
            <price>4.00</price>
        </hot>
        <hot>
            <size>Large</size>
            <price>4.50</price>
        </hot>
        <cold>
            <name>Soda</name>
            <price>3.00</price>
        </cold>
        <cold>
            <name>Fresh Juice</name>
            <price>6.00</price>
        </cold>
        <cold>
            <name>Bottled Water</name>
            <price>2.00</price>
        </cold>
    </beverages>
</menu>